ArticleId,Text,Category
334,ecb holds rates amid growth fears the european central bank has left its key interest rate unchanged at 2% for the 19th month in succession.  borrowing costs have remained on hold amid concerns about the strength of economic growth in the 12 nations sharing the euro  analysts said. despite signs of pick-up  labour markets and consumer demand remain sluggish  while firms are eyeing cost cutting measures such as redundancies. high oil prices  meanwhile  have put upward pressure on the inflation rate.  surveys of economists have shown that the majority expect borrowing costs to stay at 2% in coming months  with an increase of a quarter of a percentage point predicted some time in the second half of the year. if anything  there may be greater calls for an interest rate cut  especially with the euro continuing to strengthen against the dollar.  the euro land economy is still struggling with this recovery   said economist dirk schumacher. the ecb  may sound rather hawkish but once the data allows them to cut again  they will.  data coming out of germany on thursday underlined the problems facing european policy makers. while germany s economy expanded by 1.7% in 2004  growth was driven by export sales and lost some of its momentum in the last three months of the year.  the strength of the euro is threatening to dampen that foreign demand in 2005  and domestic consumption currently is not strong enough to take up the slack. inflation in the eurozone  however  is estimated at about 2.3% in december  above ecb guidelines of 2%. ecb president jean-claude trichet has remained upbeat about prospects for the region  and inflation is expected to drop below 2% later in 2005. the ecb has forecast economic growth in the eurozone of 1.9% in 2005.,business
35,insurance bosses plead guilty another three us insurance executives have pleaded guilty to fraud charges stemming from an ongoing investigation into industry malpractice.  two executives from american international group (aig) and one from marsh & mclennan were the latest. the investigation by new york attorney general eliot spitzer has now obtained nine guilty pleas. the highest ranking executive pleading guilty on tuesday was former marsh senior vice president joshua bewlay.  he admitted one felony count of scheming to defraud and faces up to four years in prison. a marsh spokeswoman said mr bewlay was no longer with the company. mr spitzer s investigation of the us insurance industry looked at whether companies rigged bids and fixed prices. last month marsh agreed to pay $850m (£415m) to settle a lawsuit filed by mr spitzer  but under the settlement it  neither admits nor denies the allegations .,business
1697,us airways staff agree to pay cut a union representing 5 200 flight attendants at bankrupt us airways have agreed to a new contract that cuts pay by nearly 10%.  the deal will help the carrier  trying to survive by cutting costs by nearly $1bn (£530m) a year  save about $94m. more than two thirds of its 28 000 staff have now accepted wage cuts. but talks are still continuing with a union representing mechanics  baggage handlers and cleaners  which has so far failed to negotiate a new contract. the seventh largest carrier in the us sought bankruptcy protection for a second time in two years last september. it had been one of the quickest to deal with difficulties faced by the aviation industry after the 9/11 attacks in 2001. but it emerged from chapter 11 bankruptcy in march 2003 to face competition from low-cost carriers and higher fuel costs. us airways management has said it may need to start liquidating assets if it does not receive concessions from all staff by the middle of this month.,business
974,barclays shares up on merger talk shares in uk banking group barclays have risen on monday following a weekend press report that it had held merger talks with us bank wells fargo.  a tie-up between barclays and california-based wells fargo would create the world s fourth biggest bank  valued at $180bn (£96bn). barclays has declined to comment on the report in the sunday express  saying it does not respond to market speculation. the two banks reportedly held talks in october and november 2004.  barclays shares were up 8 pence  or 1.3%  at 605 pence by late morning in london on monday  making it the second biggest gainer in the ftse 100 index. uk banking icon barclays was founded more than 300 years ago; it has operations in over 60 countries and employs 76 200 staff worldwide. its north american divisions focus on business banking  whereas wells fargo operates retail and business banking services from 6 000 branches. in 2003  barclays reported a 20% rise in pre-tax profits to £3.8bn  and it has recently forecast similar gains in 2004  predicting that full year pre-tax profits would rise 18% to £4.5bn. wells fargo had net income of $6.2bn in its last financial year  a 9% increase on the previous year  and revenues of $28.4bn. barclays was the focus of takeover speculation in august  when it was linked to citigroup  though no bid has ever materialised. stock market traders were sceptical that the latest reports heralded a deal.  the chief executive would be abandoning his duty if he didn t talk to rivals  but a deal doesn t seem likely   reuters quoted one trader as saying.,business
2129,house prices suffer festive fall uk house prices fell 0.7% in december  according to figures from the office of the deputy prime minister.  nationally  house prices rose at an annual rate of 10.7% in december  less than the 13.7% rise the previous month. the average uk house price fell from £180 126 in november to £178 906  reflecting recent land registry figures confirming a slowdown in late 2004. all major uk regions  apart from northern ireland  experienced a fall in annual growth during december.  december is traditionally a quiet month for the housing market because of christmas celebrations. however  recent figures from the land registry - showing a big drop in sales between the last quarter of 2004 and the previous year - suggested the slowdown could be more than a seasonal blip. the volume of sales between october and december dropped by nearly a quarter from the same period in 2003  the land registry said. although both the office of the deputy prime minister (odpm) and the land registry figures point to a slowdown in the market  the most recent surveys from nationwide and halifax have indicated the market may be undergoing a revival. after registering falls at the back-end of 2004  halifax said house prices rose by 0.8% in january and nationwide reported a rise of 0.4% in the first month of the year.,business
1771,astrazeneca hit by drug failure shares in anglo-swedish drug have closed down 8% in uk trade after the failure of its iressa drug in a major clinical trial.  the lung cancer drug did not significantly prolong survival in patients with the disease. this setback for the group follows the rejection by the us in october of its anti-coagulant pill exanta. meanwhile  another of its major money spinners - cholesterol drug crestor - is facing mounting safety concerns.  this would be two of the three blockbuster drugs that were meant to power the company forward failing... and we ve got risks on crestor   said nick turner  analyst at brokers jefferies.  astrazeneca had hoped to pitch its iressa drug against rival medicine tarceva. but iressa proved no better than a placebo in extending lives in the trial involving 1 692 patients. tarceva - made by osi pharmaceuticals  genentech and roche - has already proved to be successful in helping prolong the life of lung cancer patients. aztrazeneca has now appointed a new executive director to the board. john patterson will be in charge of drug development. the company said mr patterson would make  substantial changes to the clinical organisation and its processes .  i am determined to improve our development and regulatory performance  restore confidence in the company and value to shareholders   said chief executive tom mckillop.,business
111,us trade gap hits record in 2004 the gap between us exports and imports hit an all-time high of $671.7bn (£484bn) in 2004  latest figures show.  the commerce department said the trade deficit for all of last year was 24.4% above the previous record - 2003 s imbalance of $496.5bn. the deficit with china  up 30.5% at $162bn  was the largest ever recorded with a single country. however  on a monthly basis the us trade gap narrowed by 4.9% in december to £56.4bn. the us consumer s appetite for all things from oil to imported cars  and even wine and cheese  reached record levels last year and the figures are likely to spark fresh criticism of president bush s economic policies.  democrats claim the administration has not done enough to clamp down on unfair foreign trade practices. for example  they believe china s currency policy - which us manufacturers claim has undervalued the yuan by as much as 40% - has given china s rapidly expanding economy an unfair advantage against us competitors.  meanwhile  the bush administration argues that the us deficit reflects the fact the america is growing at faster rate than the rest of the world  spurring on more demand for imported goods. some economists say this may allow an upward revision of us economic growth in the fourth quarter. but others point out that the deficit has reached such astronomical proportions that foreigners many choose not to hold as many dollar-denominated assets  which may in turn harm growth. for all of 2004  us exports rose 12.3% to $1.15 trillion  but imports rose even faster by 16.3% to a new record of $1.76 trillion. foreign oil exports surged by 35.7% to a record $180.7bn  reflecting the rally in global oil prices and increasing domestic demand. imports were not affected by the dollar s weakness last year.  we expect the deficit to continue to widen in 2005 even if the dollar gets back to its downward trend   said economist marie-pierre ripert at ixis.,business
1774,hyundai to build new india plant south korea s hyundai motor has announced that it plans to build a second plant in india to meet the country s growing demand for cars.  the company didn t give details of its investment but it said the new plant would produce 150 000 cars a year. this will boost the annual production capacity of the company - india s second-largest car manufacturer - to 400 000 units. hyundai expects its sales in india to grow 16% to 250 000 in 2005. by 2010  it expects to nearly double sales to 400 000 cars. the new plant will be built close to the existing one in chennai  in the southern province of tamil nadu.  south korea s top car maker estimates that the indian market will grow 15% this year  to 920 000 vehicles  reaching 1.6 million vehicles by 2010. demand in india has been driven by the poor state of public transport and the very low level of car ownership  analysts said. figures show that currently only eight people per thousand are car owners.  we desperately need to expand our production in order to meet growing demand in the indian auto market  which is growing over 12 percent every year  and to top our competitors   chairman chung mong-koo said in the statement. he said the company plans to use india as a base for exports to europe  latin america and the middle east. the company - which controls half of the south korean s market - aims to become a global top five auto maker by 2010.,business
1106,gazprom  in $36m back-tax claim  the nuclear unit of russian energy giant gazprom is reportedly facing a 1bn rouble ($35.7m; £19.1m) back-tax claim for the 2001-2003 period.  vedomosti newspaper reported that russian authorities made the demand at the end of last year. the paper added that most of the taxes claimed are linked to the company s export activity. gazprom  the biggest gas company in the world  took over nuclear fuel giant atomstroieksport in october 2004. the main project of atomstroieksport is the building of a nuclear plant in iran  which has been a source of tension between russia and the us.  gazprom is one of the key players in the complex russian energy market  where the government of vladimir putin has made moves to regain state influence over the sector. gazprom is set to merge with state oil firm rosneft  the company that eventually acquired yuganskneftegas  the main unit of embattled oil giant yukos. claims for back-taxes was a tool used against yukos  and led to the enforced sale yuganskneftegas. some analysts fear the kremlin will continue to use these sort of moves to boost the efforts of the state to regain control over strategically important sectors such as oil.,business
1220,ryanair in $4bn boeing plane deal budget airline ryanair has placed an order for 70 boeing 737-800 planes  in a deal valued at $4bn (£2.1bn) which should lead to 2 500 new ryanair jobs.  it also has an option for a further 70 aircraft  a move which brings the ryanair/boeing order book up to 225 firm orders and options on 193 more. ryanair said the new planes would help it to cut operating costs further. the carrier reported a drop in quarterly profit earlier this year after it was hit by higher fuel costs. however  when it reported the results  the airline was upbeat about prospects for 2005  despite tough competition in the budget airline market.  ryanair chairman david bonderman said that the 737-800 had  significantly reduced our unit operating costs and allowed us to reduce air fares each year for the last five years .   with this new order and new pricing in place  ryanair expects that unit operating costs (excluding fuel) will continue to fall each year for the next five years   he added. at the end of this year  ryanair will have taken delivery of about 100 new planes  while the 70 new orders are due for delivery between 2008 and 2012. the airline said that when all these planes have been delivered  it will be able to carry more than 70 million passengers a year  making it europe s largest airline. about 2 500 new jobs should be created in the next seven years  it added. the order can be seen as good news for boeing  which in recent years has been overtaken by european plane maker airbus as the world s biggest-selling plane maker.,business
40,german growth goes into reverse germany s economy shrank 0.2% in the last three months of 2004  upsetting hopes of a sustained recovery.  the figures confounded hopes of a 0.2% expansion in the fourth quarter in europe s biggest economy. the federal statistics office said growth for the whole of 2004 was 1.6%  after a year of contraction in 2003  down from an earlier estimate of 1.7%. it said growth in the third quarter had been zero  putting the economy at a standstill from july onward. germany has been reliant on exports to get its economy back on track  as unemployment of more than five million and impending cuts to welfare mean german consumers have kept their money to themselves. major companies including volkswagen  daimlerchrysler and siemens have spent much of 2004 in tough talks with unions about trimming jobs and costs. according to the statistics office  destatis  rising exports were outweighed in the fourth quarter by the continuing weakness of domestic demand.  but the relentless rise in the value of the euro last year has also hit the competitiveness of german products overseas. the effect has been to depress prospects for the 12-nation eurozone as a whole  as well as germany. eurozone interest rates are at 2%  but senior officials at the rate-setting european central bank are beginning to talk about the threat of inflation  prompting fears that interest rates may rise. the ecb s mandate is to fight rising prices by boosting interest rates - and that could further threaten germany s hopes of recovery.,business
1511,soros group warns of kazakh close the open society institute (osi)  financed by billionaire george soros  has accused kazakhstan officials of trying to close down its local office.  a demand for unpaid taxes and fines of $600 000 (£425 000) is politically motivated  the osi claimed  adding that it paid the money in october. the organisation has found itself in trouble after being accused of helping to topple georgia s former president. it denies having any role  but offices have had to close across the region.  the osi shut its office in moscow last year and has withdrawn from uzbekistan and belarus. in the ukraine earlier this year  mr soros - who took on the bank of england in the 1990s - and won  was pelted by protestors.  this legal prosecution can be considered an attempt by the government to force soros foundation-kazakhstan to cease its activities in kazakhstan and shut its doors for kazakh citizens and organisations   the osi said.  the osi aims to promote democratic and open  market-based societies. since the break up of the soviet union in 1991  kazakhstan has been dominated by its president nursultan abish-uly nazarbayev. he has powers for life  while insulting the president and officials has been made a criminal offence. the government controls the printing presses and most radio and tv transmission facilities. it operates the country s national radio and tv networks. recent elections were criticised as flawed and the opposition claimed there was widespread vote rigging. supporters  however  say he brings much needed stability to a region where islamic militancy is on the rise. they also credit him with promoting inter-ethnic accord and pushing through harsh reforms.,business
770,european losses hit gm s profits general motors (gm) saw its net profits fall 37% in the last quarter of 2004  as it continued to be hit by losses at its european operations.  the us giant earned $630m (£481.5m) in the october-to-december period  down from $1bn in the fourth quarter of 2003. gm s revenues rose 4.7% to $51.2bn from $48.8bn a year earlier. the fourth-quarter losses at general motors europe totalled $345m  up from $66m during the same period in 2003. gm s main european brands are opel and vauxhall.  excluding special items  gm s global income from continuing operations totalled $569m during the quarter  down from $838m a year earlier. the results were in line with wall street expectations and shares in gm rose by about 1% in pre-market trade. for the whole of 2004  gm earned $3.7bn  down from $3.8bn in 2003  while its annual revenue rose 4.5% to $193bn. gm said its profits were also hit by higher healthcare costs in the us.  gm reported solid overall results in 2004  despite challenging competitive conditions in many markets around the globe   gm chairman and chief executive rick wagoner said in a statement. the company recently announced that it expected profits in 2005 to be lower than in 2004.,business
1159,disney settles disclosure charges walt disney has settled charges from us federal regulators that it failed to disclose how family members of directors were employed by the company.  the media giant was not fined by the securities and exchange commission  but has agreed to refrain from any future violations of securities law. disney failed to tell investors that between 1999 and 2001 it employed three adult children of three then directors. the firm has neither admitted nor denied wrongdoing in the settlement.  the three disney directors in question in the central matter of the sec s investigation - reveta bowers  stanley gold and raymond watson - have all since left the company  with ms bowers and mr watson both retiring  and mr gold quitting in 2003. their children were paid between $60 000 (£30 800) and $150 000 a year  with shareholders not being informed. the sec also found that disney did not disclose that a 50% disney-owned subsidiary company - lifetime - employed the wife of current disney director john bryson  and that she earned more than $1m a year. louise bryson remains with lifetime.  disney also failed to disclose payments to air shamrock  an airline owned by mr gold and fellow former disney directors roy disney. finally  disney also did not reveal that it provided more than $200 000 annually for office space  secretarial services  and a leased car and driver to former director thomas murphy.  shareholders have a significant interest in information regarding relationships between the company and its directors   said sec deputy enforcement director linda thomsen.  failure to comply with the sec s disclosure rules in this area impedes shareholders  ability to evaluate the objectivity and independence of directors.,business
1657,egypt and israel seal trade deal in a sign of a thaw in relations between egypt and israel  the two countries have signed a trade protocol with the us  allowing egyptian goods made in partnership with israeli firms free access to american markets.  the protocol  signed in cairo  will establish what are called  qualified industrial zones  in egypt. products from these zones will enjoy duty free access to the us  provided that 35% of their components are the product of israeli-egyptian cooperation. the us describes this as the most important economic agreement between egypt and israel in two decades.  the protocol establishing the zones has been stalled for years. there has been deep sensitivity in egypt about any form of co-operation with israel as long as its peace process with the palestinians remains blocked. but in recent weeks an unusual warmth has crept into relations between the two countries. both exchanged prisoners earlier this month  with egypt handing back an israeli who has served eight years in prison after being convicted for spying.  egyptian president hosni mubarak has described israeli prime minister ariel sharon as the best chance for the palestinians to achieve peace. the government in cairo now believes mr sharon is moving towards the centre and away from the positions of right wing groups. it also believes the us  pressed by europe  is now more willing to engage seriously in the search for a settlement. but there are also pressing economic reasons for egypt s decision to enter into the trade agreement. it will give a huge boost to egyptian textile exports  which are about to suffer a drop after new regulations come into force in the us at the beginning of the year.,business
1824,qantas considers offshore option australian airline qantas could transfer as many as 7 000 jobs out of its home country as it seeks to save costs  according to newspaper reports.  chief executive geoff dixon was quoted by the australian newspaper as saying the carrier could no longer afford to remain  all-australian . unions criticised the possible move - which may affect cabin and maintenance staff - saying qantas was profitable. more than 90% of the airline s staff are based in australia.  qantas confirmed it was looking at whether it might recruit and source products overseas - potentially through joint ventures - but said it would continue to create jobs in australia.  despite making a record australian dollars 648m ($492m) profit last year  qantas has argued that it needs to make considerable savings if it is to remain competitive.  we re going to have to get the lowest cost structure we can and that willmean sourcing things more and more from overseas   the newspaper quoted qantas chief executive geoff dixon as saying. early this year  qantas increased the number of flight attendants based in london from 370 to 870. if qantas were to follow the lead of other airlines moving staff  offshore  7 000 jobs could shift overseas  the newspaper reported. in a statement  qantas said it was looking to build its operations overseas. however  it stressed this would not result in large scale redundancies in its home market  where most of its 35 000 staff are employed.  we are totally committed to continuing to grow jobs in australia   mr dixon said.  we are  however  operating in a global market and there is no room for complacency simply because we are currently profitable and successful.   unions reacted angrily to the reported disclosure  arguing that qantas was profitable and did not need to take such action.  we could understand if qantas was a struggling airline about to go under   michael mijatov  international division secretary of the flight attendants association  told agence france presse.  qantas announced a record profit last year and is on course this year for an even greater profit so it is totally unnecessary.  in an effort to meet the challenge posed by low cost carriers  qantas sought a tie-up with air new zealand last year however  the deal was thrown out by the new zealand high court on competition grounds.,business
