ArticleId,Text,Category
289,brown targets oaps and homebuyers gordon brown has doubled the level at which house buyers pay stamp duty to £120 000 as he put the economy at the heart of labour s election campaign.  the chancellor also unveiled a one-off £200 council tax refund for pensioners and a rise in child tax credit. mr brown put 1p a pint on beer  4p on a bottle of wine and 7p on 20 cigarettes but froze petrol duty until september. the tories called it a  vote now  pay later  budget. the lib dems branded it a  sticking plaster  for the election.  tory leader michael howard predicted the budget would do nothing to help labour s  faltering  election campaign.   this government and this chancellor have run out of solutions to the problems britain faces   mr howard told mps.  their only answer is to tax  to spend and to waste - to get people to vote now and pay later.  he ended his response with an election challenge to labour  saying  bring it on . liberal democrat leader charles kennedy attacked mr brown for failing to mention the environment and for his record on social justice.  how can it be right in britain today that the poorest 20% pay more in tax  as a proportion of their income  than the richest 20%   he asked.  mr kennedy criticised mr brown for failing to mention the  ticking bomb  of council tax revaluation  saying it was  high time  the system was replaced by a  local tax based on the ability to pay . during his 49 minute speech mr brown told mps he had defied the pundits by hitting his growth target of 3.1% for 2004.  he said his budget struck a balance  between tax cuts that are affordable  investments that are essential and stability that is paramount . he rejected across-the-board tax cuts in favour of targeted help for families. the child tax credit will rise in line with earnings  giving families an extra £5 a week. in contrast  the personal income tax allowance will rise only in line with inflation from £4 745 to £4 895 next month. mr brown told mps child benefit would rise to a maximum of £63 a week for the first child and £111 for two children. despite his giveaways  budget documents show mr brown clawed back £265m through a clampdown on tax avoidance and increased revenue from a windfall tax on oil companies. he also scrapped stamp duty relief for commercial property in disadvantaged areas - a measure brought in just over three years ago. bbc political editor andrew marr suggested the sweeteners were not big enough to have a transforming effect on voters. but trust in mr brown s economic stewardship would be a central election issue  he said.  mr brown also unveiled plans for a memorial to the queen mother  funded through a special coin to celebrate the queen s 80th birthday. other measures include equal tax status for same-sex couples and a deal with the council of mortgage lenders to boost low cost home ownership. the level where people start paying inheritance tax will also rise from £263 000 to £275 000 from april. mr brown said he had met his financial  golden rule  with a £6bn surplus and he said public borrowing would continue to fall over the next five years.  the economy had grown for 50 consecutive quarters  he said  and was forecast to continue doing so over the next year  with a forecast of 3% to 3.5% in 2005 and 2.5% to 3% in 2006. the first £2bn of value-for-money savings identified in the gershon review have been achieved  the chancellor said. some 12 500 civil servant posts have been axed  and 7 800 relocated out of the south east of england  he added. snp leader alex salmond said mr brown had failed the  tartan test  as there were no measures to boost the scottish economy. simon thomas  of plaid cymru  called it a budget for middle england. uk independence party leader roger knapman attacked the plans for pensioners saying they needed  more money and the dignity of being allowed to spend it how they want   not  free bus rides . the green party said the budget was a  wasted opportunity  for environmental protection  adding:  brown obviously has an eye on the coming election  and has taken his eye off the needs of the planet.,politics
1571,donor attacks blair-brown  feud  the reported feud between tony blair and gordon brown has prompted a labour donor to say he will almost certainly refuse to give more funds.  duncan bannatyne also attacked the government over iraq and its  poor  response to the asian tsunami crisis. his broadside came as ex-foreign secretary robin cook said he hoped mr brown would be premier at some point. mr bannatyne has previously given labour £50 000. he made his fortune from care homes and health clubs.  the 52-year-old on tuesday said was he was reviewing his donations because of cabinet disunity and international issues. his spokesman said it was highly unlikely he would give labour more money  although he would remain a supporter and not fund the conservatives.  robert peston s new book has prompted more speculation about the blair-brown rift with its claims that the prime minister broke a promise made in 2003 to stand down. mr bannatyne said:  disunity in the cabinet has a corrosive effect on the country.  gordon brown is a great chancellor who has delivered a stable economy  but business wants that to continue and not be blown off course by petty squabbles based on personal ambition.  the businessman  whose latest venture is a casino in newcastle  also voiced concern about the ongoing violence in iraq.  and he branded the uk government s response to the tsunami as  piecemeal and poor .  the people there need practical help not just pledges of money   he said.  the us has forces helping on the ground - we can do more.  british navy ships have helped the relief effort and the prime minister has said the government could ultimately give hundreds of millions of pounds in aid. mr bannatyne is due to host a new television programme and is also appearing on bbc2 business start-up programme dragon s den. but his spokesman insisted his attack on labour was not a publicity stunt.  in a separate development  robin cook gave his support to mr brown s prime ministerial ambitions but told a lunch for political journalists winning the election had to be labour s election. but he insisted the recent squabbles between mr blair and mr brown were not  perceived as a problem by the voters   adding there was no impression of governmental incompetence. mr cook argued that more prominence was given to these matters because there was  not an alternative source of opposition to the government . he warned the  abstentions party  was the real challenge to labour - and they would not be motivated by mr blair s promise to produce an  unremittingly new labour  election manifesto. his comments come after dave prentis  the leader of britain s biggest union unison  told the daily record newspaper he wants a date to be set for mr blair to be replaced as labour leader.,politics
105,howard pitches for uk ethnic vote michael howard is to make a pitch for britain s ethnic vote urging people who feel  taken for granted  by tony blair to vote conservative.  he will say conservatives  share the same values  as the uk s minorities. and that he wants to build a  better britain  where everyone  whatever the colour of their skin or religion  can  make the most of their talents . but the tory leader will argue against positive discrimination saying it is  outdated and unjust .   it sets family against family and it leads ethnic communities to doubt their own abilities   he will argue. mr howard - himself the son of immigrants - will acknowledge that racial discrimination still exists in the uk.  people from ethnic communities  for example  still earn less than their white counterparts   he will say before arguing the answer to helping everyone to get on was  free enterprise  free trade  free speech . the tory leader will also call for religious tolerance arguing that hindus and sikhs as well as muslims got  caught in the downdraft of islamaphobia which was one of the terrible side effects of 9/11 .  mr howard will make his speech during a visit to support tory parliamentary hopefuls robert light and sayeeda warsi -  the first british muslim woman  selected to run for mp as a conservative candidate. he will attack labour s record in government over issues such as tax and he will set out tory plans for an immigration quota to be set by mps. mr howard will also attack the lib dems for wanting to abolish faith schools  introduce compulsory sex education from the age of seven  and  give contraceptives out in schools from the age of 11 .  so i say to all those people from ethnic minorities who feel mr blair and the liberal democrats take their votes for granted - come join us   he will say. lib dem president simon hughes branded mr howard  arrogant and wrong  for claiming the tories were the  natural party  for britain s ethnic minorities.  given the tories  considerably reduced support in urban areas  where many black and asian britons live  during their time in power  the evidence simply does not support his claims that the conservatives are the party for these communities   he said.,politics
2035,errors  doomed first dome sale the initial attempt to sell the millennium dome failed due to a catalogue of errors  a report by the government s finance watchdog says.  the report said too many parties were involved in decision-making when the attraction first went on sale after the millennium exhibition ended. the national audit office said the dome cost taxpayers £28.7m to maintain and sell in the four years after it closed. finally  a deal to turn it into a sport and entertainment venue was struck. more than £550m could now be returned to the public sector in the wake of the deal to regenerate the site in greenwich  london.  the nao report said that this sale went through because it avoided many of the problems of the previous attempt to sell the dome. deputy prime minister john prescott said a good deal had been secured.  delivery of the many benefits secured through this deal will continue the substantial progress already made at the millennium village and elsewhere on the peninsula   he said. but edward leigh  who is chairman of the commons public accounts committee  warned the government would have to work hard to ensure taxpayers would get full benefit from the dome deal. he said:  this report also shows that the first attempt to sell the dome proved a complete fiasco. every arm of government seems to have had a finger in the pie. the process was confused and muddled.  he added:  four years after the millennium exhibition closed  the government finally has a deal to find a use for what has been a white elephant since it closed in a deal that  incredible as it may seem  should bring in some money and provide a benefit for the local area and the country as whole. however  it was more a question of luck that a strong bid turned up after thefirst abortive attempt.  nao head sir john bourn said:  in difficult circumstances following the failure of the first competition  english partnerships and the office of the deputy prime minister have worked hard to get a deal.,politics
2006,police urge pub closure power new powers are needed to close disorderly pubs  bars and clubs for up to a week or even permanently  police chiefs have told mps.  association of chief police officers president chris fox said the current 24-hour closure power did not have enough impact on bad landlords. mr fox s comments follow the controversy over plans to allow pubs to open around the clock. he rejected critics  calls for the law change to be delayed. instead  the new licensing act could help reduce drunken disorder - but only if it was properly planned  he argued.  acpo made its call for stronger closure powers in a paper for the commons home affairs select committee. after the meeting  mr fox said being able to close premises for only 24 hours did not necessarily make an impact.  if it s 12.30 on a saturday morning and you close for 24 hours there s not a lot of pain for the premises because they probably wouldn t open on sunday anyway.   this is about getting through to the management that they can t run a disorderly house without facing some immediate sanctions.  under acpo s proposal  the closure orders would be used only with the agreement of the local licensing authority. the new licensing laws will give police greater powers to close pubs and clubs - but only for 24-hour periods.  mr fox said the drinks industry was currently not regulating itself.  it s making money at the cost of human misery and the public purse  and the strategic planning process has been less than useless   he said. mr fox said the new laws  due to start being phased in next month  could help if food outlets  public transport and public toilets could cope with late-night drinkers.  staggering it (closing hours) will be a solution if the infrastructure is there  if the premises are properly managed and people aren t being served rolling drunk and underage and then tossed out into the street   he said.  we have the problem from 11pm to 2am in any event. we have to get a grip on the underlying causes of this.   acpo wants pubs and clubs which cause extra work for police and hospitals to have to pay towards the costs. home secretary charles clarke is currently looking at the idea of a levy on the drinks industry to pay for the cost of extra policing. the licensing changes have sparked concern among some mps  councils and some senior police officers who fear they could exacerbate drinking problems. culture secretary tessa jowell on tuesday said it was not her job to bow to the campaign against the changes. it was the status quo  not the new laws  which were causing current binge drinking problems  she told bbc two s newsnight. leaked documents have suggested ex-home secretary david blunkett branded new opening hours as a  leap in the dark . but ms jowell insisted his concerns had been met. the police s job against alcohol-related crime would be made easier if all pubs did not close at the same time  she added.,politics
674,msps hear renewed climate warning climate change could be completely out of control within several decades  the scottish environment protection agency is warning a committee of msps.  experts are giving evidence on the subject to the scottish parliament s environment committee. officials believe nuclear energy and wind farms may be better options than trying to tackle global warming. solutions suggested by conservationists include reducing internal uk air travel and boosting electric trains. the evidence is part of the committee s inquiry into the impact of climate change in scotland. sepa is attempting to curb global warming gases  as pollution from transport emissions increases.  ecologists are warning msps that scotland may have to accept  significant intrusion  from wind farms. it is likely also that nuclear power will be needed for possibly several decades. sepa predict that the two methods will remain as energy sources until climate change is under control. experts studying the seas off scotland s west coast have already forecast more devastating weather of the type which caused havoc across the country last month.  they predicted that damaging storms will become more frequent. researchers from the university of the highlands and islands and southampton have been looking at wave heights in the atlantic over the last nine years. the project was conducted jointly by the environmental research institute in thurso  which is part of the university of the highlands and islands (uhi) millennium institute network  and the southampton oceanography centre. scientists carried out a series of studies  including the use of satellites to assess wave heights in the seas around the west coast and the hebrides.,politics
1690,brown shrugs off economy fears gordon brown is to freeze petrol duty increases  fund a £1bn package to avoid big council tax rises and boost childcare and maternity leave.  in an upbeat pre-budget report  he slightly increased borrowing but insisted economic targets would be met. the chancellor also hailed the longest period of growth in uk  industrial history  but denied he was  gloating . but oliver letwin  for the tories  attacked government red tape and debt  dubbing mr brown  sir wastealot .  the shadow chancellor said mr brown s  golden rule  had  turned to dross in his hands  and said he was borrowing to spend  not invest  with predicted debt over the coming years totalling £170bn. mr letwin told mps:  the tide is going out on the chancellor s credibility. he is spending  borrowing and taxing so much because he is not getting value for taxpayer s money.   vincent cable  for the liberal democrats  accused mr brown of ducking tough choices.  he said:  last week the prime minister gave us the politics of fear; this week the chancellor has offered the economics of complacency.  there are serious challenges ahead from the falling dollar and from the rapid downturn in the uk housing market and rising personal debt. but they have not been confronted.  mr brown rejected the lib dem s call to open up the government s books to the national audit office  saying decisions on tax and spending should be made by ministers. some economists say his forecasts on public finances are wishful thinking. bbc economic editor evan davis said the figures were plausible but also a gamble.  mr brown s insistence he was not  gloating  was a pointed rebuttal of a warning from new european commissioner peter mandelson. in his speech  he set out a 10-year childcare strategy for if labour wins the next election.  it includes a £285m cash injection to extend paid maternity leave from six months to nine  with parents able to transfer leave from the mother to the father. he also promised to increase free nursery education for three and four-year-olds to 15 hours from april 2007. and funds would be provided to keep schools open from 0800 to 1800gmt to look after children while their parents were at work. taken together  the measures would create a  welfare state that is truly family-friendly for the first time in its history   said mr brown. he also announced a cash hand-out for older pensioners  with payments of £50 for the over-70s as part of the winter fuel allowance. in a move ministers say should keep council tax rises below 5% next year  the chancellor said he was providing an extra £1bn for local councils. the money is expected to come from government departments such as health and education.  mr brown said he was set to meet his two fiscal rules - to borrow only to invest and keep debt  low and sustainable  - both in this economic cycle and the next. borrowing figures for 2003/4 are £35bn - £2.5bn less than the £37.5bn predicted in march s budget  as already announced by the office for national statistics. borrowing is tipped to fall to £31bn by 2005/06 - but that is still £2bn more than mr brown predicted in his march budget. inflation would be 1.75% next year and 2% in the years to follow  mr brown forecast. he also pledged an extra £105m for security and counter-terrorism. business groups have welcomed efforts to improve competitiveness and invest more in skills and innovation. but there worries about the costs of more family-friendly working. simon sweetman  from the federation of small businesses  said:  the proposals on maternity leave have clearly been made with a general election in mind and with little thought to the impact on small employers.,politics
1355,tories attack burglar  u-turns  tory leader michael howard has accused tony blair of performing u-turns over rules on using force against burglars.  the government has ruled out amending the present law  which allows  reasonable force  in self defence. mr howard branded the decision unacceptable  saying:  it is not householders who should be frightened  it s the burglars.  home secretary charles clarke said ministers had kept to their pledge to review the law.  metropolitan police commissioner sir john stevens last month backed a tory attempt to change the law so only householders using  grossly disproportionate  force could be prosecuted. the pressure prompted the prime minister to say the police and crown prosecution service would be consulted as part of a review of the law. he told mps:  if we get the right response from those people  we will  of course  support a change in the law.  instead  the government has decided no change is needed but there will be a publicity campaign so people are clear they are entitled to defend themselves. on thursday  mr howard told bbc radio 4 s today programme mr blair had initially refused the law change  then had come round to the idea and was now backtracking again. he said:  we ve had three policy positions in three months and two u-turns.  it s not surprising gordon brown told him:  there s nothing you could say to me now that i could ever believe.    mr howard said the  grossly disproportionate  test matched the hurdle ministers had introduced for civil cases where burglars where claimed compensation from householders. the issue entered the public spotlight when norfolk farmer tony martin was jailed for shooting dead a 16-year-old burglar in 1999 as he ran away from the farm. but the home secretary said mr howard was wrong to say the law was biased in favour of burglars. the barrister who had represented mr martin had said the rules were  weighted overwhelmingly  in favour of the householder  said mr clarke. he said:  the problem is there has not been enough understanding of it - that was the point sir john stevens was making and the prime minister was making.  the new guidance would help ensure clarity on the issue  added mr clarke. the director of public prosecutions  ken macdonald  says only 11 householders or occupiers of business premises have been prosecuted in the last 15 years. those cases included a warehouse manager who had waited for a burglar  tied him up  beat him and set him alight  he said. tory mp patrick mercer s private member s bill to change the law received a first reading in parliament on wednesday and goes to a full debate next month.,politics
1613,blair rejects tory terror offer tony blair has rejected a conservative compromise offer that could have eased the passage of anti-terror legislation.  the tories wanted a sunset clause inserted in the anti-terrorism bill that would have forced ministers to revisit it in november. mr blair said the bill  which brings in house arrest for terror suspects  had time limiting safeguards already. the tories say they will vote against it unless changes they want are agreed. the lib dems also oppose the plans.  the government has already given way over the role of judges in house arrest cases.  mr blair s refusal to accept the tories  sunset clause proposals means that the government faces concerted opposition from all sides in the lords. peers begin three days of detailed deliberation on the bill on thursday. the bill proposes  control orders   which as well as placing terrorism suspects under house arrest could mean curfews  tagging or bans on telephone and internet use. these would replace current powers to detain foreign terror suspects without trial  which the law lords have ruled against as a breach of human rights.  the tories want judicial oversight of all control orders  not just house arrest. shadow home secretary david davis told bbc radio four s the world at one his primary concern was potential miscarriages of justice. he said if someone was wrongly given a control order it would act as a  recruiting sergeant  for terrorists. he went on to say:  if we don t get the amendments we regard as essential  including the sunset clause  we will vote against the bill.  in the commons  mr howard said it would be  far better if the whole of the legislation was subject to a sunset clause so parliament could consider it all in a proper way instead of it being ramrodded through . mr blair said the house arrest powers were already going to be subject to a sunset clause because it was annually renewable.  the second  less stringent  type of control orders would be subject to a court appeal within 14 days and there would be a three-monthly report on their use by  an eminent and independent person .  i believe (the new powers) are a proper balance between the civil liberties of the subject and the necessary national security of this country that i will not put at risk   said mr blair. the lib dems plan to oppose the bill in the lords on thursday. lib dem home affairs spokesman mark oaten said:  there s a lot of talking left. i would be uneasy about supporting a very bad bill even if it was just for eight months.  a spokeswoman for human rights watch said it was a  basic principle  that people should only be punished after a fair trial. she added:  having a judge impose those punishments without a trial does not sanitise them either.,politics
1949,uk athletics agrees new kit deal uk athletics has agreed a new deal with adidas to supply great britain squads of all ages with their kit for the next four years.  the german-based firm kitted out team gb at the 2004 olympics and has deals with 20 other national olympic bodies. uk athletics chief david moorcroft said:  the athens experience can now be extended to more major championships.  in the year ahead these include the european indoor and world outdoor championships. we are delighted.  moorcroft added:  it is hugely beneficial to the sport that the adidas commitment will also provide for officials and other personnel at our world-class series of live televised events.  this week  uk athletics also agreed a four-year deal with energy drink company  red bull  who will be supplying the product to athletics at major domestic meetings and in high performance centres.,sport
