ArticleId,Text,Category
1332,glastonbury fans to get id cards fans who buy tickets for this year s glastonbury festival will be issued with photo id cards in an attempt to beat touts  it has been confirmed.  the cards will include a photograph of the ticket-holder plus an electronic chip with their details to prevent tickets being sold on or forged. tickets for the june event are expected to go on sale in april.  there is only one place in the world where you will be able to get tickets   festival organiser michael eavis said.  that will be the official source. if you get them anywhere else  you won t get in.  fans not wanting to carry the entrance card could present their passport or driving licence instead  he added.  more than 153 000 people are expected to travel to mr eavis  somerset farm from 24-26 june  but the event s rising popularity has meant an extremely high demand for tickets in recent years. when the id card idea was floated  mr eavis  daughter emily said it would be  quite a big step in terms of ticketing for events  if implemented and they were  going as far as we can  to cut touting.  as long as it s approached in the right way  it might really work  it might really change the system   she said. in 2004  all 112 000 tickets for the public sold out in 24 hours. they were personalised with the names of purchasers  who were asked to bring identification  such as a driving licence  passport or household bill. but some forgot to take the right information while some touts simply offered to supply their own bills along with the ticket bearing their name. no details of this year s line-up have been confirmed but rumours have suggested u2 and coldplay may be among the headliners.,entertainment
1658,ray charles studio becomes museum a museum dedicated to the career of the late legendary singer ray charles is to open in his former recording studio in los angeles.  his longtime publicist jerry digney said the museum would house  archive materials from recordings  to awards  to ephemera  to wardrobe . a tour bus used by charles and his entourage over the years will also be on permanent display. it is hoped the museum will be ready for visitors in late 2007.  mr digney said the recording studio and offices had been used by charles for many years  and was where he recorded much of his last album  genius loves company. it is hoped the museum will also house an education centre. the building had been declared a historic landmark by the city of los angeles just before charles  death in june 2004 at the age of 73. following his death  charles won eight grammy awards  including album of the year for genius loves company  a collection of duets.,entertainment
2223,rem announce new glasgow concert us band rem have announced plans to perform for 10 000 scottish fans in a rescheduled gig.  the band will play in what has been dubbed europe s biggest tent on glasgow green on tuesday  14 june. they were forced to pull out of a concert at the secc in glasgow last month after bassist mike mills contracted flu. fans who bought tickets for the original 22 february show can attend the rescheduled concert. the june gig will act as a warm-up for rem s open air concert at balloch castle country park  on the banks of loch lomond  four days later.  promoters regular music booked glasgow green as the secc was not available on the most suitable date. mark mackie  director of regular music  said:  it is fantastic news and it really shows rem s commitment to their scottish fans that they are coming back to glasgow for what will be a truly unique gig.  the rem gigs will kick-start what promises to be a memorable summer for scottish music lovers.  grammy award winners u2 will play hampden on 21 june while oasis will also perform at the national stadium in glasgow on 29 june. coldplay have announced a concert at bellahouston park in glasgow on 1 july and t in the park will be held at balado  near kinross  from 9-10 july. ticketweb and the secc box office will write to customers who bought tickets for the february gig asking if they want to attend the new show. those who bought tickets in person are being urged to return to the point of purchase. anyone who cannot make the concert will be given a refund. the cut-off date for swapping tickets is 1 april  when those remaining will go on sale to the public.,entertainment
1886,label withdraws mcfadden s video the new video of former westlife singer brian mcfadden has been pulled after a dublin school complained about being associated with his song irish son.  st fintian s high school says it is clearly identified in the video  while mcfadden never went there. mcfadden makes claims that he was beaten at his own school in the song s lyrics  saying it had  cell blocks . the performer s record label sony bmg has withdrawn the video and issued replacements to television stations. the label believed the school name was fictitious until they received the complaint. they have said the reference to the school was unintentional and coincidental.  the head of christian brothers  school st fintian s  richard fogarty  said the video implied that the 24-year-old pop star had attended his school and was abused there.  the school has always treated its pupils with respect   mr fogarty said in a statement. mcfadden makes specific references to the christian brothers in his song  but did not attend st fintian s. corporal punishment was outlawed in irish schools in 1982 when mcfadden was two years old.  mcfadden  whose debut solo album is released next week  has said that every song is autobiographical and  a true story . alcoholism and domestic violence are among the other topics dealt with in his songs  half of which have been written with robbie williams  former collaborator  guy chambers. mcfadden  who quit chart-topping group westlife in march  went to number one in september with his first solo single real to me. he enjoyed 12 chart-toppers with the boy band before parting company with them.,entertainment
1978,row over  police  power for csos the police federation has said it strongly opposes giving community support officers (csos) the power to detain suspects for up to 30 minutes.  the powers - piloted in six areas - were extended to all police forces in england and wales on thursday. the federation said csos do not have the experience  training and safety equipment to deal with  potentially confrontational  situations. but the government said the move would help police  build safe communities . police federation chairman jan berry said civilian officers should act as  eyes and ears  for the police.   they should not be placed in potentially confrontational situations - which detaining someone clearly is   she said. csos can now use reasonable force to detain suspects for up to 30 minutes while they wait for police officers to arrive. the powers will be granted by chief constables of local forces. ms berry said this  dramatically changes  their original purpose - to be a visible presence combating low-level crime and anti-social behaviour. she said more powers would mean more paperwork and less time on the street.  but home office minister hazel blears defended the move saying it would give the civilian officers  just that little bit of edge . she denied their role was changing and said the new powers would not take them away from the streets.   the powers that we are bringing in are things that they need to do when they are out patrolling   she said. the home office has produced its own report on csos which it describes as  encouraging . ms blears said the study shows csos are  making a real difference  in the fight against crime. but the report also showed that the public is having difficulties distinguishing between a civilian officer and a proper officer.  shadow home secretary david davis said the research appeared to acknowledge that csos were having no discernible effect on crime figures.   while the answer is a lot more real police  the government wants to recruit 25 000 people who can t arrest anyone   he said. bbc home affairs correspondent danny shaw said the research is inconclusive. there are about 3 500 csos in england and wales but the government intends to have 25 000 on the streets by 2008 at a cost of £50m. they already have powers to hand out fines for a wide range of offences. the serious organised crime and police bill proposes extra powers to search suspects  enforce licensing offences  direct traffic and deter begging.,politics
1938,howard denies split over id cards michael howard has denied his shadow cabinet was split over its decision to back controversial labour plans to introduce id cards.  the tory leader said his front bench team had reached a  collective view  after holding a  good discussion   but admitted it was  not an easy issue . he had decided to support the plans as the police said they would help fight terror  crime and illegal immigration. the lib dems have pledged to oppose the bill when it is debated next monday.  tory sources say senior party figures had argued vociferously against the id card scheme. among those reported to have serious reservations over the strategy were senior shadow cabinet members david davis  oliver letwin and tim yeo. but mr howard denied mr yeo  his transport and environment spokesman  said the plans  stink . he also said he was confident shadow home secretary mr davis would  set out the position very clearly  when he stands up to debate the matter next week. mr howard said the police had said id cards could  help them foil a terror bomb plot in which people could lose their lives . he added:  when the police say that you have to take them seriously .  he acknowledged there were  good libertarian arguments  against the cards  but said the shadow cabinet had weighed up all the  conflicting interests  before reaching its decision.  i don t pretend that it is an easy decision but at the end of the day a decision has to be taken.  he also denied he was afraid of looking  soft  on the issue  compared to labour. the conservatives announced their support for the government plans on monday evening.  sources within the party told the bbc mr howard had always been in favour of id cards  and tried to introduce them when he was home secretary. but the tories insisted they would hold ministers to account over the precise purpose of the scheme.  they said they would also press labour over whether objectives could be met and whether the home office would be able to deliver them. and they pledged to assess the cost effectiveness of id cards and whether people s privacy would be properly protected.  it is important to remember that this bill will take a decade to come into full effect   a spokesman said. lib dem home affairs spokesman mark oaten has branded the id scheme a waste of money and  deeply flawed . he said:  this has all the signs of michael howard overruling colleagues  concerns over id cards.   the chairman of the bar council  guy mansfield qc warned there was a real risk that people on the  margins of society  would be driven into the hands of extremists.  what is going to happen to young asian men when there has been a bomb gone off somewhere  they are going to be stopped. if they haven t [id cards] they are going to be detained.  tory ex-minister douglas hogg said he opposed the plans for id cards branding them a  regressive  step which would intrude into the lives of ordinary citizens without any counterbalancing benefits. he predicted ultimately carrying the cards would become compulsory and that would lead to large numbers of britain s ethnic minorities being stopped by police.,politics
888,minister defends hunting ban law the law banning hunting with dogs in england and wales is enforceable and  very clear   alun michael has said.  the rural affairs minister said it would become obvious if people flouted the law  which came into force on friday  and pretended they were not. some 270 hunts met legally on saturday killing a total of 91 foxes - only four were accidentally killed by hounds. but anti-hunt campaigners said there had been widespread intimidation of activists monitoring hunts. countryside alliance chairman john jackson said that saturday had been a  massive demonstration by the rural community of support for hunting . people had turned out  to show en masse that the hunting act was a bad law   he said adding that foxes and other animals had been killed  legally  as far as he was aware.  although hunting with dogs is now a criminal offence  exercising hounds  chasing a scent trail and flushing out foxes to be shot are still legal. addressing claims that the new law was unenforceable  mr michael told bbc radio 4 s today programme:  there has been a lot of spin about this by those that support hunting.  the reality is that the law is very clear. you can t chase wild mammals with a pack of dogs  whether the wild mammal is a fox or a deer.  if people do so and pretend they re not it s going to become very clear. you can t hunt accidentally.  mr michael also denied the hunting ban had led to a breakdown of trust between the government and rural communities. he said most people living in the countryside were more concerned with issues like the economy  the health service and their children s future than hunting.  but the league against cruel sports claimed the new act had been broken even though the numbers of foxes killed had fallen. thousands of hunt supporters turned out at 270 hunts across england and wales on the first day of the ban  with anti-hunt groups sending out 100 monitors to check the law was not being broken. there were only four arrests - over alleged hunting of hares in wiltshire - although it was not clear whether they were made under the hunting act.  they have been released on bail but police say they may face prosecution under new poaching laws. but penny little  who monitored the bicester hunt in oxfordshire  said she had witnessed  gratuitous  spiteful killing of foxes . if people tried to  run circles around this law  the only outcome would be that it was tightened up  she said. mike hobday  from the league against cruel sports  said video evidence of the law being broken would be passed onto police. he said intimidation seemed to have been widespread and called on hunts to do more to stop their supporters intimidating anti-hunt activists videoing hunts. but mr jackson  who had been at the bicester hunt in oxfordshire  denied there was any intimidation.,politics
2063,will the budget bring out smiling voters  as tory spokesman oliver letwin said - any chancellor would use his pre-election budget to offer some vote winning sweeteners  wouldn t he.  and everyone does  indeed  expect gordon brown to do just that in his last budget before the expected polling day of 5 may. there will be plenty of talk about taking no risks with the economy or handing out irresponsible giveaways. but mr brown will stun westminster and break just about every historical precedent if he fails to do something designed to put a smile on voters  faces and make them more inclined to back labour in the election. and there has already been speculation about possible tax reductions for the poorest and increasing the threshold on stamp duty in this week s budget. the aim of his package will be to keep any disillusioned core labour voters in the fold  while ensuring the middle england voters who gave tony blair two election victories don t desert him at the third poll.  and  needless to say  there will be plenty of analysis of what impact the budget will have on mr brown s own ambitions to replace mr blair as prime minister at some point after a third win. but there is a shadow hanging over this pre-election performance - in the shape of £11 billion or thereabouts. that is the size of the financial  black hole  the tories  backed by some independent forecasters  believe mr brown will have to fill with tax increases after the election.  the opening shot in that battle was fired at the weekend with claims a treasury leak suggested mr brown was ready to slap capital gains tax on home sales to raise some of that cash. it was immediately denied  but the tories remain suspicious  claiming that  as mr letwin said  if the money does not come from there  where will it come from.  mr brown will undoubtedly claim the forecasts are simply wrong and that he will have absolutely no need to raise taxes after the election  should labour win. previous gloomy forecasts proved wrong  he will argue  while suggesting that only by sticking with him can britain continue to have a sound economy  low unemployment and high public spending. the opposition will reject that by claiming they can keep the economy sound  increase spending and cut taxes at the same time.  the liberal democrats will also promise to run a sound economy  but based on increased taxes to fund spending and  amongst other things  abolishing the council tax in favour of a local income tax. and there will be prolonged argument over which of the parties can make the greatest savings in whitehall and beyond to fund their policies. but probably what that all boils down to is a simple question of which of the parties the voters most trust to keep the economy stable and avoid any unpleasant surprises in the coming years. and it is probably still the answer to that one question that will overwhelmingly decide the outcome of the general election.,politics
870,voters  reject eu by two to one  british voters would reject the european constitution by two to one  according to a poll posing the question the government will put to the country.  the daily telegraph poll suggests that 45% of people would vote against the constitution and 24% in favour. however the yougov poll  which questioned 1 943 british adults online  found 25% did not know how they would vote if forced to decide tomorrow. only 51% of those polled had made up their minds about the constitution. another 7% said they would not vote at all. the poll is believed to be the first to pose the question which the government has chosen for the upcoming referendum  expected in 2006. the constitution will be incorporated into uk law if there is a yes vote.  ballot papers in the poll will ask:  should the united kingdom approve the treaty establishing a constitution for the european union   the government unveiled the question which will be asked earlier in the week.  the treaty was signed by all 25 current eu members in rome last october and is due to come into force in november 2006  providing it is ratified by all member states - several of which will hold a referendum. critics say the constitution is a further step towards a federal europe  but advocates say it ensures effective operation of the enlarged 25-state eu.  if we reject this treaty  britain will be isolated and weak in europe   said foreign secretary jack straw  after the question was unveiled. mr straw  along with the rest of the cabinet  will back a  yes  vote. meanwhile  conservative shadow foreign secretary michael ancram said the referendum question  seems straightforward . but he accused the government of trying to confuse the issue by putting the eu referendum question in the same bill as the ratification of the constitution  when they should be treated as  two separate issues .,politics
1013,galloway targets  new labour  mp george galloway is to stand against pro-iraq war labour mp oona king at the next general election.  mr galloway  who on thursday won £150 000 in libel damages from the daily telegraph said he would contest bethnal green  in london  for respect. the glasgow kelvin mp  who was expelled from labour over his anti iraq war stance  accused ms king of being a  new labour stooge . ms king said she was  delighted  at the chance to take on mr galloway.  mr galloway s current constituency is set to disappear under planned boundary changes in scotland.  the 50-year-old mp launched respect  the unity coalition  in january along with 1 000 anti-war activists  and the muslim association of britain. the party s declared aims are an end to the occupation of iraq  the repeal of anti-union laws and the end of privatisation. speaking from a cafe in brick lane  east london  mr galloway said he had accepted the party s invitation to stand with  great honour and pride .  he added:  here in this constituency of bethnal green and bow there is a new labour stooge mp.  a stooge who will sing any song  make any speech  do any dance  do anything she is told to by tony blair - irrespective of how her constituents are adversely affected or how strongly they feel to the contrary.  ms king has represented the constituency since 1997. she said:  i m delighted i ve been given the chance to finish him (mr galloway) off  and believe me i will.  i know many people around the country will be grateful  not least his constituents in scotland who he has shamelessly abandoned.  in june s european parliament elections  respect failed to gain enough votes for an mep but did come first in tower hamlets borough  most of which is covered by the commons constituency of bethnal green and bow.  a month later it gained a council seat in a by-election in st dunstan s and stepney green ward  tower hamlets. mr galloway said that in next year s expected general election and local elections a year later  the party would  turn the east end of london into a fortress . both the conservatives and the liberal democrats have chosen prospective parliamentary candidates for bethnal green and bow from the bangladeshi population  which makes up almost half the electorate. the telegraph was sued for libel by mr galloway after the newspaper claimed he received money from saddam hussein s regime in iraq. the newspaper said it was in the public interest to publish the claims  based on documents found in baghdad. mr justice eady said he was  obliged to compensate mr galloway... and to make an award for the purposes of restoring his reputation .,politics
1079,stalemate in pension strike talks talks aimed at averting national strikes over pension reforms have ended without agreement after 90 minutes.  five public sector unions met deputy prime minister john prescott at the labour spring conference in gateshead. they want the government to withdraw regulations - due to be introduced in weeks - which would raise the pension age for council workers from 60 to 65. up to 1.4 million workers could take part in strikes earmarked for 23 march. discussions will resume next week.  a spokesman for unison  britain s biggest union  said after saturday s meeting:  at least we are still talking.  all sides are anxious to avoid a major confrontation in the run up to the general election  said bbc labour affairs correspondent stephen cape. in four days  unison will start balloting 800 000 local government workers on strikes. other public sector unions have pledged to follow. the five unions which met mr prescott want the government to withdraw these regulations. this would allow months of tough negotiations to follow  said our correspondent. but a spokesman for mr prescott warned that the changes to the local government pension scheme would have to go ahead in april.  privately ministers believe this will be the  less painful  option  our correspondent added. the public and commercial services union (pcs) will co-ordinate any industrial action with up to six other public sector unions. pcs leader mark serwotka warned last week that there could be further walkouts unless there was a government rethink.  for a government that lectures everyone on choice - choice on public service  choice on this and choice on that - isn t it ironic that they re saying to public sector workers there is no choice   he said.  if you want the pension you were promised when you started you must work for an extra five years - that is working until people drop.  in the 20th century  it s completely unacceptable.   unison s 800 000 workers  the transport and general workers  union s 70 000 and amicus  20 000 are among those being balloted about a 23 march walkout. mr prescott held a private meeting with senior union figures last week. it is understood no deal was offered in that meeting but there was room for further negotiations.,politics
